{
  "$schema": "https://json-schema.org/draft/2020-12/schema",
  "$id": "FrontierStageSetting.json",
  "title": "FrontierStageSetting",
  "type": "array",
  "items": {
    "type": "object",
    "properties": {
      "Id": {
        "type": "integer",
        "minimum": 10101,
        "maximum": 100109
      },
      "UnlockedStageids": {
        "type": "array",
        "minItems": 0,
        "maxItems": 1
      },
      "UnlockedNodes": {
        "type": "array",
        "minItems": 0,
        "maxItems": 2
      },
      "Camp": {
        "type": "integer",
        "minimum": 1,
        "maximum": 6,
        "enum": [
          1,
          2,
          3,
          4,
          5,
          6
        ]
      },
      "Seat": {
        "type": "integer",
        "minimum": 4,
        "maximum": 12,
        "enum": [
          4,
          6,
          8,
          10,
          12
        ]
      },
      "Node": {
        "type": "integer",
        "minimum": 101,
        "maximum": 1001
      },
      "Difficulty": {
        "type": "integer",
        "minimum": 1,
        "maximum": 16,
        "enum": [
          1,
          2,
          3,
          4,
          5,
          6,
          7,
          8,
          9,
          10,
          11,
          12,
          13,
          14,
          15,
          16
        ]
      },
      "General": {
        "type": "integer",
        "minimum": 20013,
        "maximum": 29142
      },
      "PrizeMerit": {
        "type": "integer",
        "minimum": 1,
        "maximum": 10,
        "enum": [
          1,
          2,
          5,
          10
        ]
      },
      "PrizeGold": {
        "type": "integer",
        "minimum": 0,
        "maximum": 21000,
        "enum": [
          0,
          1500,
          4500,
          12000,
          21000
        ]
      },
      "PrizeIndustry": {
        "type": "integer",
        "minimum": 0,
        "maximum": 3000,
        "enum": [
          0,
          450,
          900,
          1800,
          3000
        ]
      },
      "PrizeEnergy": {
        "type": "integer",
        "minimum": 0,
        "maximum": 750,
        "enum": [
          0,
          90,
          240,
          480,
          750
        ]
      },
      "PrizeTech": {
        "type": "integer",
        "minimum": 0,
        "maximum": 45,
        "enum": [
          0,
          6,
          15,
          30,
          45
        ]
      },
      "PrizeExp": {
        "type": "integer",
        "minimum": 480,
        "maximum": 12000,
        "enum": [
          480,
          1800,
          6000,
          12000
        ]
      },
      "PrizeDecoration": {
        "type": "integer",
        "minimum": 0,
        "maximum": 1061,
        "enum": [
          0,
          1051,
          1061
        ]
      },
      "BuffId": {
        "type": "array",
        "minItems": 0,
        "maxItems": 3
      },
      "Photo": {
        "type": "integer",
        "minimum": 1,
        "maximum": 9,
        "enum": [
          1,
          2,
          3,
          4,
          5,
          6,
          7,
          8,
          9
        ]
      },
      "RoundPhoto": {
        "type": "string",
        "minLength": 15,
        "maxLength": 20
      }
    },
    "required": [
      "Id",
      "UnlockedStageids",
      "UnlockedNodes",
      "Camp",
      "Seat",
      "Node",
      "Difficulty",
      "General",
      "PrizeMerit",
      "PrizeGold",
      "PrizeIndustry",
      "PrizeEnergy",
      "PrizeTech",
      "PrizeExp",
      "PrizeDecoration",
      "BuffId",
      "Photo",
      "RoundPhoto"
    ],
    "additionalProperties": false
  }
}
